ID	label	Type	Domain	Range	Characteristics	Properties	Description	Comment
HED_0000101	hasHedSection	ObjectProperty	HedSchema	HedSection			Indicates this schema contains this section.	Maps a HedSection into a HedSchema.
HED_0000102	inHedSection	ObjectProperty	HedEntity	HedSection			Indicates what section the element appears in.	Maps a HedEntity into its appropriate HedSection class.
HED_0000103	inHedSchema	ObjectProperty	HedElement	HedSchema				
HED_0000104	hasUnitType	ObjectProperty	HedUnit	HedUnitClass			Associates a HedUnit with its category (HedUnitClass).	Maps HedUnit into HedUnitClass, allowing tools to place a unit in its correct grouping.
HED_0000105	defaultUnits	ObjectProperty	HedUnitClass	HedUnit		unitClassDomain, unitRange	The default units to use if the placeholder has a unit class but the substituted value has no units.	
HED_0000106	relatedTag	ObjectProperty	HedTag	HedTag		tagDomain, nodeRange	A HED tag that is closely related to this tag. This attribute is used by tagging tools.	
HED_0000107	suggestedTag	ObjectProperty	HedTag	HedTag		tagDomain, stringRange	A tag that is often associated with this tag. This attribute is used by tagging tools to provide tagging suggestions.	
HED_0000108	unitClass	ObjectProperty	HedTag	HedUnitClass		tagDomain, stringRange	The unit class that the value of a placeholder node can belong to.	Maps a HedTag into a HedUnitClass name as a string.
HED_0000109	valueClass	ObjectProperty	HedTag	HedValueClass		tagDomain, stringRange	Type of value taken on by the value of a placeholder node.	Maps a HedTag into a HedValueClass name as a string.